{
  "$schema": "../../../../../docs/content/schema/lesson.schema.json",
  "kind": "lesson",
  "id": "lesson.attention_rules.01",
  "version": 1,
  "moduleId": "psy0",
  "familyId": "attention_rules",
  "order": 1,
  "title": { "fr": "Formes et couleurs : transformer des règles en réflexes" },
  "summary": { "fr": "Règles conditionnelles à deux touches, encodage moteur en trente secondes, gestion du retour d'erreur en direct et routine d'échauffement." },
  "file": { "fr": "lessons/attention_rules/01-formes-et-couleurs.fr.md" },
  "estimatedReadMin": 9,
  "difficulty": 2,
  "tags": ["attention_rules", "attention_rules.strategy", "attention.stroop"],
  "practiceTags": ["attention_rules"],
  "deckIds": ["deck.attention_rules"],
  "status": "published",
  "meta": { "author": "hbock", "source": "own text; format from docs/content/psy0-spec.md section 2.4 C" }
}
