{
  "$schema": "../../../../../docs/content/schema/lesson.schema.json",
  "kind": "lesson",
  "id": "lesson.selection_process.02",
  "version": 1,
  "moduleId": "psy0",
  "order": 2,
  "title": { "fr": "Checklist du jour J : matériel, fenêtre de 36 h, déroulement" },
  "summary": { "fr": "Préparer l'ordinateur, la webcam et la pièce, choisir son créneau dans les 36 h, et dérouler la session sans brouillon ni retour en arrière." },
  "file": { "fr": "lessons/selection_process/02-checklist-jour-j.fr.md" },
  "estimatedReadMin": 7,
  "difficulty": 1,
  "tags": ["selection_process", "selection_process.exam_day"],
  "practiceTags": [],
  "deckIds": ["deck.selection_process"],
  "status": "published",
  "meta": { "author": "hbock", "source": "own text; facts from docs/content/psy0-spec.md sections 2.1, 2.2, 2.4, 4.4" }
}
